Title,Description,Year,Runtime,Genres,Seasons
An astrological guide for broken hearts,"Mid-thirties and still single (certainly not by choice), Alice is working at a small television network in a job with limited upward mobility, despite often being the most competent person in the room. To add insult to injury, her ex-boyfriend Carlo is getting married and about to become a father. And as if that weren't enough, in the small television production company she works for, a new charming and mysterious creative director, Davide, arrives to put everyone to the test. Alice's life begins to change when she meets Tio, an actor on the network's flagship soap opera and self-professed astrological guru, who will soon become her personal ""astrological guide for broken hearts"".",2021,34,"['comedy', 'romance']",2.0
Sophie: A Murder in West Cork,A shocking murder in rural Ireland sets off an increasingly convoluted quest for justice that spans decades and cuts across national borders.,2021,55,"['crime', 'documentation', 'history']",1.0
Standing Up,"From odd jobs to the hunt for viral fame, making a career in stand-up comedy isn't easy, but four friends risk everything to make the world laugh.",2022,46,"['comedy', 'drama']",1.0
Who Rules The World,"A legendary wuxia romance that focuses on the decade-long romance between Hei Fengxi and Bai Fengxi, and the adventures they embark on together.",2022,44,"['drama', 'fantasy', 'romance']",1.0
Monsters Inside: The 24 Faces of Billy Milligan,"In the late 1970s, an accused serial rapist claims multiple personalities control his behavior, setting off a legal odyssey that captivates America.",2021,61,"['crime', 'documentation']",1.0
Countdown: Inspiration4 Mission to Space,"From training to launch to landing, this all-access docuseries rides along with the Inspiration4 crew on the first all-civilian orbital space mission.",2021,50,['documentation'],1.0
Glória,A small town in Portugal becomes engulfed in a web of political intrigue when a young engineer is recruited as a KGB spy in this historical thriller.,2021,44,"['drama', 'history', 'thriller']",1.0
This Is a Robbery: The World's Biggest Art Heist,"In 1990, two men dressed as cops con their way into a Boston museum and steal a fortune in art. Take a deep dive into this daring and notorious crime.",2021,53,"['crime', 'history', 'documentation']",1.0
Heist,Millions in stolen cash. Missing luxury bourbon. Watch ordinary people almost get away with these extraordinary heists in this true crime series.,2021,43,"['crime', 'documentation']",1.0
History of Swear Words,This proudly profane series explores the history and impact of some of the most notorious bad words in the English language.,2021,21,"['comedy', 'documentation']",1.0
Trese,"Set in Manila where the mythical creatures of Philippine folklore live in hiding amongst humans, Alexandra Trese finds herself going head to head with a criminal underworld comprised of malevolent supernatural beings.",2021,29,"['crime', 'action', 'fantasy', 'horror', 'thriller', 'animation', 'scifi']",1.0
The Sound of Magic,An enigmatic magician living in an abandoned amusement park introduces magic into the life of a high schooler struggling with harsh realities.,2022,69,"['drama', 'fantasy', 'music']",1.0
High on the Hog: How African American Cuisine Transformed America,"Black food is American food. Chef and writer Stephen Satterfield traces the delicious, moving throughlines from Africa to Texas in this docuseries.",2021,47,['documentation'],1.0
He's Expecting,"When a successful ad executive who's got it all figured out becomes pregnant, he's forced to confront social inequities he'd never considered before.",2022,26,"['drama', 'comedy', 'romance']",1.0
He-Man and the Masters of the Universe,Mighty teen Adam and his heroic squad of misfits discover the legendary power of Grayskull — and their destiny to defend Eternia from sinister Skeletor.,2021,26,"['scifi', 'action', 'fantasy', 'animation', 'comedy', 'drama', 'family']",2.0
Colin in Black & White,The life of athlete Colin Kaepernick and his adoptive parents as they navigate the challenges of raising a black son in a white family and community.,2021,32,"['drama', 'sport']",1.0
The Sons of Sam: A Descent Into Darkness,"The Son of Sam case grew into a lifelong obsession for journalist Maury Terry, who became convinced that the murders were linked to a satanic cult.",2021,60,"['documentation', 'crime', 'history']",1.0
Crime Scene: The Times Square Killer,"In 1970s NYC, the “Torso Killer” preys on women to fulfill his grotesque fantasies while eluding police. A docuseries dive into crime’s darkest places.",2021,49,"['crime', 'documentation', 'history']",1.0
Gone for Good,"Ten years ago, he lost two loved ones. When his fiancée disappears, he must uncover buried secrets — or lose everything. Based on Harlan Coben's novel.",2021,49,"['drama', 'crime', 'thriller']",1.0
High-Rise Invasion,"High-school girl Yuri suddenly finds herself on the rooftop of a high-rise building. She's trapped in a bizarre world surrounded by skyscrapers, where a masked man cracked open a man's head with an axe before her eyes. Finding a way to survive this bizarre world, find her beloved brother, and escape becomes her top priority, but she is beset by danger not just from the mysterious Masks, which possess both inhuman strength and cruelty, but other survivors turned cruel or desparate by the insanity of the high-rise world.",2021,25,"['action', 'horror', 'scifi', 'thriller', 'animation']",1.0
Record of Ragnarok,"Before eradicating humankind from the world, the gods give them one last chance to prove themselves worthy of survival. Let the Ragnarok battles begin.",2021,24,"['scifi', 'drama', 'fantasy', 'thriller', 'animation', 'action']",1.0
"Money, Explained","We spend it, we borrow it, and save it. Now let's talk about money and its many minefields, from credit cards to casino, scammers to student loans.",2021,23,['documentation'],1.0
The Way of the Househusband,"Tatsu, a notorious and feared yakuza leader nicknamed ""The Immortal Dragon,"" withdraws from the criminal syndicate and becomes a housekeeper to help his wife, Miku. The series features a variety of comedic settings, typically showing Tatsu's domestic activities and intimidating inequality with his looks, as well as multiple encounters with his former colleagues and rivals in the Japanese Criminal Syndicate.",2021,17,"['animation', 'action', 'comedy', 'crime', 'drama', 'romance']",1.0
Fate: The Winx Saga,"The coming-of-age journey of five fairies attending Alfea, a magical boarding school in the Otherworld where they must learn to master their powers while navigating love, rivalries, and the monsters that threaten their very existence.",2021,50,"['scifi', 'drama', 'fantasy', 'action']",1.0
Shaman King,"Shaman King follows the adventures of a 13-year-old shaman and his teammate a samurai warrior spirit, who traverse the world fighting evil spirits and misguided shamans on their journey to be the next Shaman King.",2021,23,"['comedy', 'fantasy', 'animation', 'action', 'scifi']",1.0
Jaguar,"In 1960s Spain, a Holocaust survivor joins a group of agents seeking justice against the hundreds of Nazis who fled to the nation to hide after WWII.",2021,43,"['war', 'action', 'drama', 'history']",1.0
Yasuke,"In a war-torn feudal Japan filled with mechs and magic, the greatest ronin never known, Yasuke, struggles to maintain a peaceful existence after a past life of violence. But when a local village becomes the center of social upheaval between warring daimyo, Yasuke must take up his sword and transport a mysterious child who is the target of dark forces and bloodthirsty warlords.",2021,29,"['scifi', 'action', 'drama', 'fantasy', 'thriller', 'animation']",1.0
Saturday Morning All Star Hits!,Follows Skip and Treybor as they celebrate all that is 80s and 90s television.,2021,23,"['animation', 'comedy']",1.0
Post Mortem: No One Dies in Skarnes,"Live Hallangen is declared dead but hours later she suddenly wakes up with a sudden urge for blood. Meanwhile, her brother Odd tries to keep the family driven funeral home afloat.",2021,45,"['thriller', 'comedy', 'drama']",1.0
The Cook of Castamar,"Set in early 18th-century Madrid, the plot follows the love story between an agoraphobic cook and a widowed nobleman.",2021,54,['drama'],1.0
Thirty-Nine,"Leaning on each other through thick and thin, a trio of best friends stand together as they experience life, love and loss on the brink of turning 40.",2022,73,"['drama', 'romance']",1.0
Blippi Wonders,"Ever curious Blippi sets off on comedic and fun adventures in his BlippiMobile along with his faithful sidekicks TABBS & FETCH, who help him find the answers to a burning question of the day. This animated series allows us to take Blippi places he couldn't normally go in live-actions and appeal audiences around the world.",2021,7,['animation'],1.0
Bulgasal: Immortal Souls,The story of a woman who has gone through several reincarnations over the course of 600 years and remembers all of her past lives and a man who has lived for over 600 years as a mythical creature that feeds off human blood and is cursed with immortality.,2021,71,"['scifi', 'thriller', 'drama', 'fantasy']",1.0
Pretty Smart,A self-proclaimed intellectual is forced to move in with her carefree sister and her sister's lovably eccentric friends.,2021,24,"['comedy', 'drama', 'romance']",1.0
Jump like a Witch,Female celebrities gather on court to learn from seasoned coaches and train for victory as members of a newly formed amateur basketball team.,2022,97,['reality'],1.0
My Unorthodox Life,The personal and professional life of fashion mogul Julia Haart - former member of an ultra-Orthodox Jewish community turned CEO of Elite World Group.,2021,40,['reality'],1.0
On the Verge,"Four women, a chef, a single mom, an heiress, and a job seeker dig into love and work, with a generous side of midlife crises, in pre-pandemic LA.",2021,32,"['comedy', 'drama']",1.0
"Devotion, a Story of Love and Desire","Fidelity tells a story of marital fidelity, in particular the one of Carlo and Margherita, a young couple who needs to face the deflagrant consequences of an alleged betrayal. Their relationship becomes a symbol of fidelity, not only as a couple, but also in the personal choices made every day.",2022,40,"['drama', 'romance']",1.0
Baki Hanma,"To gain the skills he needs to surpass his powerful father, Baki enters Arizona State Prison to take on the notorious inmate known as Mr. Unchained.",2021,24,"['thriller', 'animation', 'action', 'drama', 'sport']",2.0
The King's Affection,"When the crown prince is killed, his twin sister assumes the throne while trying to keep her identity and affection for her first love a royal secret.",2021,66,['drama'],1.0
Juvenile Justice,A tough judge balances her aversion to minor offenders with firm beliefs on justice and punishment as she tackles complex cases inside a juvenile court.,2022,61,"['drama', 'crime']",1.0
City of Ghosts,"Meet the Ghost Club! Their adventures take them all around Los Angeles as they interview ghosts, solve problems and learn about their city's history.",2021,19,['drama'],1.0
DOTA: Dragon's Blood,"After encounters with a dragon and a princess on her own mission, a Dragon Knight becomes embroiled in events larger than he could have ever imagined.",2021,26,"['scifi', 'action', 'thriller', 'animation', 'fantasy']",2.0
Blue Period,"Bored with life, popular high schooler Yatora Yaguchi jumps into the beautiful yet unrelenting world of art after finding inspiration in a painting.",2021,25,"['animation', 'drama']",1.0
The Club,"The most unexpected people can become your chosen family in a place you never thought could be home. In 1950s Istanbul, amid political unrest, a Jewish mother seeks to reconnect with her daughter after being released from prison.",2021,47,"['drama', 'comedy']",2.0
The Raincoat Killer: Chasing a Predator in Korea,"In the early 2000s, Yoo Young-chul hammered his victims to death and cast fear across Seoul. This docuseries recounts the hunt for a prolific killer.",2021,48,"['documentation', 'crime', 'history']",1.0
School of Chocolate,"Eight top pastry and chocolate professionals elevate their skills under the supervision of world-renowned chocolatier, Amaury Guichon.",2021,38,['reality'],1.0
Falling Into Your Smile,"Student Tong Yao makes two vows: to never be in a relationship with someone in the same field and to make up for the Chinese League of Legends. When Tong Yao earns her spot as the first formal female player in China's professional league, she catches the attention of an elite team captain. Facing doubts and inconveniences, she meets each challenge with her own persistence and her teammates' support. After much effort, what will become of her vows? Will she stand on the world stage to make up for six years of regret? Will she avoid a romantic entanglement within the e-sports world?  Adapted from the novel You're Beautiful When You Smile by Qing Mei.",2021,44,"['drama', 'comedy', 'romance']",1.0
Godzilla Singular Point,"Brought together by a mysterious song, a grad student and an engineer lead the fight against an unimaginable force that may spell doom for the world.",2021,24,"['scifi', 'animation', 'action', 'thriller']",1.0
Snabba Cash,"The entrepreneurial jet set as well as the criminal world is more brutal, chaotic and ruthless than ever. When these two worlds collide, loyalty, friendships, and business partners will be tested in the never-ending quest for easy money.",2021,43,"['drama', 'thriller', 'action', 'crime']",2.0
Cocaine Cowboys: The Kings of Miami,Two childhood friends go from high school dropouts to the most powerful drug kingpins in Miami in this true story of a crime sage that spanned decades.,2021,53,"['documentation', 'crime', 'history']",1.0
Wild Abandon,"In the haze of a midlife crisis, an architect begins living a double life as a punk while members of his family lead their own crisis-ridden lives.",2022,51,"['drama', 'comedy']",1.0
EDENS ZERO,"Aboard the Edens Zero, a lonely boy with the ability to control gravity embarks on an adventure to meet the fabled space goddess known as Mother.",2021,24,"['action', 'scifi']",1.0
Pretty Guardians Sailor Moon Eternal The Movie,"When a dark power enshrouds the Earth after a total solar eclipse, the scattered Sailor Guardians must reunite to bring light back into the world.",2021,81,['action'],1.0
The Upshaws,"Bennie Upshaw, the head of a Black working class family in Indianapolis, is a charming, well-intentioned mechanic and lifelong mess just trying his best to step up and care for his family and tolerate his sardonic sister-in-law, all without a blueprint for success.",2021,30,['comedy'],2.0
Love (ft. Marriage and Divorce),"Everything comes unraveling for three successful women who work on a radio show as twists, turns and troubles plague their seemingly happy marriages.",2021,69,"['drama', 'romance']",3.0
Neymar: The Perfect Chaos,"Beloved worldwide but also a lightning rod for criticism, Neymar shares the highs and lows of his personal life and brilliant football career.",2022,55,"['documentation', 'sport']",1.0
"Nevertheless,",The intoxicating charm of a flirtatious art school classmate pulls a reluctant love cynic into a friends-with-benefits relationship.,2021,69,"['drama', 'romance']",1.0
Eden,"Thousands of years in the future, a city known as ""Eden 3"" is inhabited solely by robots whose former masters vanished a long time ago. On a routine assignment, two farming robots accidentally awaken a human baby girl from stasis questioning all they were taught to believe -- that humans were nothing more than a forbidden ancient myth. Together, the two robots secretly raise the child in a safe haven outside Eden.",2021,25,"['scifi', 'fantasy', 'animation', 'action', 'drama', 'family']",1.0
Tribes of Europa,"2074. In the wake of a mysterious global disaster, war rages between the Tribes that have emerged from the wreckage of Europe. Three siblings from the peaceful Origine tribe are separated and forced to forge their own paths in an action-packed fight for the future of this new Europa.",2021,47,"['scifi', 'fantasy', 'action', 'drama']",1.0
Q-Force,A handsome secret agent and his team of LGBTQ superspies embark on extraordinary adventures.,2021,23,"['scifi', 'animation', 'action', 'comedy', 'crime', 'fantasy']",1.0
Bad Sport,True crime and sports come together in this docuseries. Global controversies and scandals are explored through reports from those involved.,2021,65,"['crime', 'sport', 'documentation']",1.0
Age of Samurai: Battle for Japan,An exploration of the warring kingdoms of feudal Japan when several powerful warlords fought to become absolute ruler.,2021,43,"['drama', 'history', 'war', 'documentation', 'action']",1.0
Bling Empire,"Follow LA's wildly wealthy Asian and Asian American fun seekers as they go all out with fabulous parties, glamour and drama in this reality series.",2021,39,['reality'],2.0
Surviving Death,"What happens after we die? This docuseries explores personal stories and research on near-death experiences, reincarnation and paranormal phenomena.",2021,54,"['documentation', 'reality']",1.0
Dig Deeper: The Disappearance of Birgit Meier,"After Birgit Meier vanishes in 1989, police missteps plague the case for years. But her brother never wavers in his tireless quest to find the truth.",2021,59,"['crime', 'documentation']",1.0
The Journalist,A journalist known as the maverick of news media defiantly chases the truth in this series adaptation of the hit movie of the same name.,2022,51,"['drama', 'thriller']",1.0
Baking Impossible,Innovative bakers are paired with the brightest engineers to compete in designing and baking creations that are both delicious and made to survive intense engineering stress tests.,2021,49,['reality'],1.0
Beyond Evil,"A serial murder case takes place in the small, peaceful city. The case is the same serial murder case that took place 20 years ago and changed Lee Dong-sik’s life. The two detectives work to catch the killer.",2021,66,"['crime', 'thriller', 'drama']",1.0
Centaurworld,"Centaurworld follows a war horse who is transported from her embattled world to a strange land inhabited by silly, singing centaurs of all species, shapes, and sizes. Desperate to return home, she befriends a group of these magical creatures and embarks on a journey that will test her more than any battle she's ever faced before.",2021,29,"['scifi', 'action', 'family', 'fantasy', 'animation', 'comedy']",2.0
Power Rangers Dino Fury,"When an army of powerful alien beings is unleashed on Earth threatening life as we know it, a brand-new team of Power Rangers, fueled by the prehistoric power of the dinosaurs, are recruited to deal with the threat.",2021,21,"['comedy', 'drama', 'fantasy', 'scifi', 'thriller', 'action']",2.0
Our Beloved Summer,"Years after filming a viral documentary in high school, two bickering ex-lovers get pulled back in front of the camera — and into each other's lives.",2021,60,"['drama', 'comedy']",1.0
House of Secrets: The Burari Deaths,"Suicide, murder or something else? This docuseries examines chilling truths and theories around the deaths of 11 members of a Delhi family.",2021,45,"['documentation', 'crime', 'history']",1.0
Open Your Eyes,"After a tragic accident, an amnesiac teen tries to rebuild her life at a memory disorders center but becomes suspicious of her unconventional treatment.",2021,47,"['scifi', 'drama', 'thriller']",1.0
Savage Beauty,"In Savage Beauty, Rosemary Zimu plays Zinhle - a first young woman with a tragic past who is determined to take revenge on the Bhengus family, who destroyed a lot of lives with their infernal vision.

Don and Grace Bhengu once used street children to test a toxic beauty product. Many of those children do not have children, but one of the survivors has developed and particular vengeance. But she knows she has to play it smart to play the powerful family.",2022,0,['drama'],1.0
Tiger King: The Doc Antle Story,"A lifelong showman, Bhagavan “Doc” Antle has built his various careers on theatrics, attracting a slew of admirers along the way. But beneath the eccentric, animal-loving facade lies a predator far more dangerous than his beloved big cats and a man shadier than any of his Tiger King counterparts.",2021,42,"['crime', 'documentation']",1.0
Tear Along the Dotted Line,A cartoonist in Rome with his armadillo-for-a-conscience reflects on his path in life and a would-be love as he and his friends travel outside the city.,2021,19,"['drama', 'comedy', 'animation']",1.0
Feels Like Ishq,Short films follow young adults as they navigate the gamut of emotions that come with finding romantic connection in unexpected places.,2021,42,"['drama', 'romance', 'comedy']",1.0
The Creature Cases,"Follows Sam Snow and Kit Casey, two brilliant agents, as they solve mysteries that mix real zoological facts with wild detective action.",2022,0,"['animation', 'family', 'action', 'comedy']",1.0
Octonauts: Above & Beyond,"The Octonauts expand their exploration beyond the sea -- and onto land! With new rides and new friends, they'll protect any habitats and animals at risk.",2021,25,"['family', 'animation']",1.0
Senzo: Murder of a Soccer Star,"Soccer player Senzo Meyiwa was a national hero before his killing shocked South Africa. Who did it, and why? This docuseries dives into the evidence.",2022,40,"['crime', 'documentation']",1.0
The Crew,"When the owner of the fictional NASCAR Bobby Spencer Racing team steps down and passes the team off to his daughter Catherine, the crew chief has to protect himself and his crew from her attempts to  modernize.",2021,29,['comedy'],1.0
The Unlikely Murderer,"After the assassination of prime minister Olof Palme in 1986, Stig Engström managed to elude justice right up to his death through a combination of audacity, luck, and a perplexed police force.",2021,46,"['drama', 'crime']",1.0
Byron Baes,"Australian influencers flock to Byron Bay for its warm, beachy beauty and cool, creative vibe. Follow these friends as they negotiate life and love.",2022,45,['reality'],1.0
The Kingdom,"After his running mate's murder, a controversial televangelist becomes Argentina's presidential candidate. But nothing about him is as holy as he seems.",2021,47,"['drama', 'crime']",1.0
Spycraft,"The spy game is a serious business, and throughout history, the tools and technologies developed for it have mattered as much as the spies themselves.",2021,34,['documentation'],1.0
"Sex, Love & Goop",Courageous couples head for more pleasurable sex and deeper intimacy with help from Gwyneth Paltrow and a team of experts in this reality series.,2021,35,"['comedy', 'romance']",1.0
Thomas & Friends: All Engines Go!,"In a reboot of the classic TV series, a younger Thomas The Tank Engine goes on adventures with all of his friends, as they work on The Island Of Sodor.",2021,11,"['animation', 'comedy', 'fantasy', 'drama', 'music', 'family']",1.0
Sparking Joy with Marie Kondo,"In this reality series, Marie Kondo brings her joyful tidying tactics to people struggling to balance work and home life and shares her own world.",2021,20,['reality'],1.0
Elite Short Stories: Guzmán Caye Rebe,"Rebe hosts an intimate house warming party for her friends, but the situation takes a dramatic turn with the help of drugs and unexpected visitors.",2021,12,"['drama', 'crime', 'thriller']",1.0
Elite Short Stories: Patrick,"Away from school, during the winter holidays, three new stories take place while the Las Encinas students celebrate Christmas.",2021,12,"['comedy', 'drama']",1.0
Top Secret UFO Projects: Declassified,"Though claims of extraterrestrial encounters have long been dismissed, many believe the existence of UFOs is not just likely, but a certainty.",2021,43,['documentation'],1.0
Getting Curious with Jonathan Van Ness,Jonathan Van Ness lets curiosity lead the way while roving from snacks to wigs in this podcast spinoff chock-full of experts and special guests.,2022,26,"['comedy', 'reality']",1.0
The Orbital Children,"In 2045, two children born on the moon and three kids from Earth try to survive after an accident on their space station leaves them stranded.",2022,32,"['action', 'scifi', 'drama', 'fantasy', 'animation']",2.0
Move to Heaven,"Finding life in all that's left behind, a trauma cleaner with Asperger's and his ex-con uncle deliver the untold stories of the departed to loved ones.",2021,52,['drama'],1.0
Gabby's Dollhouse,This colorful series leads preschoolers room to room through a fantastical dollhouse of delightful mini-worlds and irresistible kitty characters.,2021,23,"['fantasy', 'animation', 'comedy', 'family']",4.0
Fatma,"Reeling from tragedy, a nondescript house cleaner embarks on a murderous streak as she searches for her missing husband and reckons with old wounds.",2021,42,"['crime', 'drama', 'thriller']",1.0
Single’s Inferno,"On a deserted island, flirtatious singles look for love, because only as a couple can they leave the island for a romantic date in paradise.",2021,64,['reality'],2.0
Inspector Koo,"A reclusive ex-cop reenters the game as an insurance investigator, searching for clues in crime scenes perfectly staged by a serial killer in her midst.",2021,69,"['action', 'comedy', 'thriller']",1.0
Last Chance U: Basketball,Hit the hardwood in East Los Angeles as a coach with strong convictions leads young men who hope to fulfill major college potential.,2021,60,"['documentation', 'sport']",1.0
Waffles + Mochi,Curious puppet pals Waffles and Mochi travel the world exploring the wonders of food and culture while learning how to cook with fresh ingredients.,2021,30,['family'],1.0
